{"$schema":"https://json-schema.org/draft/2020-12/schema","$id":"https://github.com/newcovid/nonebot-plugin-yijing/data/schemas/casting_rules.schema.json","title":"casting_rules","description":"Casting method metadata records.","type":"array","items":{"type":"object","additionalProperties":true,"required":["id","name","enabled","description"],"properties":{"id":{"type":"string","minLength":1},"name":{"type":"string"},"enabled":{"type":"boolean"},"probability":{"type":"object","additionalProperties":{"type":"integer","minimum":0}},"description":{"type":"string"}}}}
